<?xml version="1.0" encoding="ISO-8859-1" ?>
<!DOCTYPE program [
<!ATTLIST program name CDATA #REQUIRED>
<!ELEMENT program (cfgs,srcfile*)>
<!ELEMENT cfgs (cfg*)>
<!ATTLIST cfg
   id ID #REQUIRED
   main CDATA #IMPLIED
   name CDATA #IMPLIED>
<!ELEMENT cfg (bb+)>
<!ATTLIST bb id ID #REQUIRED>
<!ELEMENT bb (prec?,inst*,succ?)>
<!ELEMENT prec (link+)>
<!ELEMENT succ (link+)>
<!ATTLIST link
   type (taken|nottaken|call) #REQUIRED
   cfg IDREF #REQUIRED
   bb IDREF #REQUIRED
   cond CDATA #IMPLIED>
<!ELEMENT link EMPTY>
<!ATTLIST inst
   src IDREF #IMPLIED
   line CDATA #IMPLIED
   addr CDATA #REQUIRED
   type (ipoint|label|op|jump|branch|call|ret) #IMPLIED
   name CDATA #IMPLIED
   operands CDATA #IMPLIED
   cond CDATA #IMPLIED>
<!ELEMENT inst EMPTY>
<!ATTLIST srcfile
   id ID #REQUIRED
   name CDATA #IMPLIED>
<!ELEMENT srcfile (#PCDATA)>
]>

<program name="main">
   <cfgs>
      <cfg id="c6" name="gnc__passive__opcs__compute" main="true">
         <bb id="c6b1">
            <inst addr="0x4002E4DC" src="s1" line="11"/>
            <inst addr="0x4002E4E0"/>
            <inst addr="0x4002E4E4" src="s1" line="12"/>
            <inst addr="0x4002E4E8" src="s1" line="14"/>
            <inst addr="0x4002E4EC"/>
            <inst addr="0x4002E4F0"/>
            <inst addr="0x4002E4F4" src="s1" line="15"/>
            <inst addr="0x4002E4F8"/>
            <inst addr="0x4002E4FC"/>
            <inst addr="0x4002E500" src="s1" line="16"/>
            <succ>
               <link type="nottaken" cfg="c6" bb="c6b2"/>
            </succ>
         </bb>
         <bb id="c6b2">
            <prec>
               <link type="nottaken" cfg="c6" bb="c6b1"/>
               <link type="nottaken" cfg="c6" bb="c6b12"/>
            </prec>
            <inst addr="0x4002E504"/>
            <inst addr="0x4002E508"/>
            <inst addr="0x4002E50C"/>
            <succ>
               <link type="nottaken" cfg="c6" bb="c6b3"/>
               <link type="taken" cfg="c6" bb="c6b4"/>
            </succ>
         </bb>
         <bb id="c6b3">
            <prec>
               <link type="nottaken" cfg="c6" bb="c6b2"/>
            </prec>
            <inst addr="0x4002E510"/>
            <inst addr="0x4002E514" src="s1" line="22"/>
            <inst addr="0x4002E518"/>
            <succ>
               <link type="call" cfg="c7" bb="c7b1"/>
               <link type="nottaken" cfg="c6" bb="c6b7"/>
            </succ>
         </bb>
         <bb id="c6b4">
            <prec>
               <link type="taken" cfg="c6" bb="c6b2"/>
            </prec>
            <inst addr="0x4002E510"/>
            <inst addr="0x4002E538" src="s1" line="29"/>
            <inst addr="0x4002E53C"/>
            <inst addr="0x4002E540"/>
            <inst addr="0x4002E544" src="s1" line="30"/>
            <inst addr="0x4002E548"/>
            <succ>
               <link type="nottaken" cfg="c6" bb="c6b6"/>
            </succ>
         </bb>
         <bb id="c6b6">
            <prec>
               <link type="nottaken" cfg="c6" bb="c6b4"/>
               <link type="nottaken" cfg="c6" bb="c6b13"/>
            </prec>
            <inst addr="0x4002E54C"/>
            <inst addr="0x4002E550"/>
            <inst addr="0x4002E554"/>
            <succ>
               <link type="nottaken" cfg="c6" bb="c6b8"/>
               <link type="taken" cfg="c6" bb="c6b9"/>
            </succ>
         </bb>
         <bb id="c6b7">
            <prec>
               <link type="nottaken" cfg="c6" bb="c6b3"/>
            </prec>
            <inst addr="0x4002E51C" src="s1" line="26"/>
            <inst addr="0x4002E520"/>
            <succ>
               <link type="call" cfg="c8" bb="c8b1"/>
               <link type="nottaken" cfg="c6" bb="c6b12"/>
            </succ>
         </bb>
         <bb id="c6b8">
            <prec>
               <link type="nottaken" cfg="c6" bb="c6b6"/>
            </prec>
            <inst addr="0x4002E558"/>
            <inst addr="0x4002E55C" src="s1" line="32"/>
            <inst addr="0x4002E560"/>
            <succ>
               <link type="call" cfg="c9" bb="c9b1"/>
               <link type="nottaken" cfg="c6" bb="c6b13"/>
            </succ>
         </bb>
         <bb id="c6b9">
            <prec>
               <link type="taken" cfg="c6" bb="c6b6"/>
            </prec>
            <inst addr="0x4002E558"/>
            <inst addr="0x4002E578" src="s1" line="35"/>
            <inst addr="0x4002E57C"/>
            <inst addr="0x4002E580"/>
            <inst addr="0x4002E584" src="s1" line="11"/>
            <inst addr="0x4002E588" src="s1" line="37"/>
            <inst addr="0x4002E58C"/>
            <inst addr="0x4002E590"/>
            <inst addr="0x4002E594"/>
         </bb>
         <bb id="c6b12">
            <prec>
               <link type="nottaken" cfg="c6" bb="c6b7"/>
            </prec>
            <inst addr="0x4002E524" src="s1" line="16"/>
            <inst addr="0x4002E528"/>
            <inst addr="0x4002E52C"/>
            <inst addr="0x4002E530" src="s1" line="28"/>
            <inst addr="0x4002E534"/>
            <succ>
               <link type="nottaken" cfg="c6" bb="c6b2"/>
            </succ>
         </bb>
         <bb id="c6b13">
            <prec>
               <link type="nottaken" cfg="c6" bb="c6b8"/>
            </prec>
            <inst addr="0x4002E564" src="s1" line="30"/>
            <inst addr="0x4002E568"/>
            <inst addr="0x4002E56C"/>
            <inst addr="0x4002E570" src="s1" line="33"/>
            <inst addr="0x4002E574"/>
            <succ>
               <link type="nottaken" cfg="c6" bb="c6b6"/>
            </succ>
         </bb>
      </cfg>
      <cfg id="c7" name="xgnc__aocs">
         <bb id="c7b1">
            <prec>
               <link type="call" cfg="c6" bb="c6b3"/>
            </prec>
            <inst addr="0x4002E35C" src="s2" line="34"/>
            <inst addr="0x4002E360" src="s2" line="38"/>
            <inst addr="0x4002E364"/>
            <inst addr="0x4002E368"/>
            <inst addr="0x4002E36C"/>
            <inst addr="0x4002E370"/>
            <inst addr="0x4002E374"/>
            <inst addr="0x4002E378"/>
            <inst addr="0x4002E37C"/>
            <inst addr="0x4002E380"/>
            <succ>
               <link type="call" cfg="c12" bb="c12b1"/>
               <link type="nottaken" cfg="c7" bb="c7b3"/>
            </succ>
         </bb>
         <bb id="c7b3">
            <prec>
               <link type="nottaken" cfg="c7" bb="c7b1"/>
            </prec>
            <inst addr="0x4002E384" src="s2" line="40"/>
            <inst addr="0x4002E388"/>
            <inst addr="0x4002E38C"/>
            <inst addr="0x4002E390"/>
            <inst addr="0x4002E394"/>
            <inst addr="0x4002E398"/>
            <succ>
               <link type="call" cfg="c13" bb="c13b1"/>
               <link type="nottaken" cfg="c7" bb="c7b5"/>
            </succ>
         </bb>
         <bb id="c7b5">
            <prec>
               <link type="nottaken" cfg="c7" bb="c7b3"/>
            </prec>
            <inst addr="0x4002E39C" src="s2" line="44"/>
            <inst addr="0x4002E3A0"/>
            <inst addr="0x4002E3A4"/>
            <inst addr="0x4002E3A8"/>
            <inst addr="0x4002E3AC"/>
            <inst addr="0x4002E3B0"/>
            <inst addr="0x4002E3B4"/>
            <inst addr="0x4002E3B8"/>
            <inst addr="0x4002E3BC"/>
            <inst addr="0x4002E3C0"/>
            <inst addr="0x4002E3C4"/>
            <inst addr="0x4002E3C8"/>
            <inst addr="0x4002E3CC"/>
            <succ>
               <link type="call" cfg="c14" bb="c14b1"/>
               <link type="nottaken" cfg="c7" bb="c7b7"/>
            </succ>
         </bb>
         <bb id="c7b7">
            <prec>
               <link type="nottaken" cfg="c7" bb="c7b5"/>
            </prec>
            <inst addr="0x4002E3D0" src="s2" line="53"/>
            <inst addr="0x4002E3D4"/>
            <inst addr="0x4002E3D8"/>
            <inst addr="0x4002E3DC"/>
            <inst addr="0x4002E3E0"/>
            <inst addr="0x4002E3E4"/>
            <succ>
               <link type="call" cfg="c15" bb="c15b1"/>
               <link type="nottaken" cfg="c7" bb="c7b9"/>
            </succ>
         </bb>
         <bb id="c7b9">
            <prec>
               <link type="nottaken" cfg="c7" bb="c7b7"/>
            </prec>
            <inst addr="0x4002E3E8" src="s2" line="57"/>
            <inst addr="0x4002E3EC"/>
            <inst addr="0x4002E3F0"/>
            <inst addr="0x4002E3F4"/>
            <inst addr="0x4002E3F8"/>
            <inst addr="0x4002E3FC"/>
            <inst addr="0x4002E400"/>
            <inst addr="0x4002E404"/>
            <inst addr="0x4002E408"/>
            <inst addr="0x4002E40C"/>
            <inst addr="0x4002E410"/>
            <succ>
               <link type="call" cfg="c16" bb="c16b1"/>
               <link type="nottaken" cfg="c7" bb="c7b11"/>
            </succ>
         </bb>
         <bb id="c7b11">
            <prec>
               <link type="nottaken" cfg="c7" bb="c7b9"/>
            </prec>
            <inst addr="0x4002E414" src="s2" line="61"/>
            <inst addr="0x4002E418"/>
            <inst addr="0x4002E41C"/>
            <inst addr="0x4002E420"/>
            <inst addr="0x4002E424"/>
            <inst addr="0x4002E428"/>
            <inst addr="0x4002E42C"/>
            <inst addr="0x4002E430"/>
            <inst addr="0x4002E434"/>
            <inst addr="0x4002E438"/>
            <inst addr="0x4002E43C"/>
            <inst addr="0x4002E440"/>
            <inst addr="0x4002E444"/>
            <inst addr="0x4002E448"/>
            <inst addr="0x4002E44C"/>
            <inst addr="0x4002E450"/>
            <inst addr="0x4002E454"/>
            <inst addr="0x4002E458"/>
            <inst addr="0x4002E45C"/>
            <inst addr="0x4002E460"/>
            <inst addr="0x4002E464"/>
            <inst addr="0x4002E468"/>
            <inst addr="0x4002E46C"/>
            <inst addr="0x4002E470"/>
            <inst addr="0x4002E474"/>
            <inst addr="0x4002E478"/>
            <inst addr="0x4002E47C"/>
            <inst addr="0x4002E480"/>
            <inst addr="0x4002E484"/>
            <inst addr="0x4002E488"/>
            <inst addr="0x4002E48C"/>
            <inst addr="0x4002E490"/>
            <inst addr="0x4002E494"/>
            <inst addr="0x4002E498"/>
            <inst addr="0x4002E49C"/>
            <succ>
               <link type="call" cfg="c17" bb="c17b1"/>
               <link type="nottaken" cfg="c7" bb="c7b13"/>
            </succ>
         </bb>
         <bb id="c7b13">
            <prec>
               <link type="nottaken" cfg="c7" bb="c7b11"/>
            </prec>
            <inst addr="0x4002E4A0" src="s2" line="69"/>
            <inst addr="0x4002E4A4"/>
            <inst addr="0x4002E4A8"/>
         </bb>
      </cfg>
      <cfg id="c12" name="xgnc__guidance__gnc_q4_0_q3_0_q2_0_q1_0">
         <bb id="c12b1">
            <prec>
               <link type="call" cfg="c7" bb="c7b1"/>
            </prec>
            <inst addr="0x4002D2BC" src="s3" line="9"/>
            <inst addr="0x4002D2C0"/>
            <inst addr="0x4002D2C4"/>
            <inst addr="0x4002D2C8" src="s3" line="12"/>
            <inst addr="0x4002D2CC"/>
            <inst addr="0x4002D2D0"/>
            <inst addr="0x4002D2D4"/>
            <inst addr="0x4002D2D8"/>
            <inst addr="0x4002D2DC"/>
            <inst addr="0x4002D2E0"/>
            <succ>
               <link type="nottaken" cfg="c12" bb="c12b2"/>
               <link type="taken" cfg="c12" bb="c12b3"/>
            </succ>
         </bb>
         <bb id="c12b2">
            <prec>
               <link type="nottaken" cfg="c12" bb="c12b1"/>
            </prec>
            <inst addr="0x4002D2E4"/>
            <inst addr="0x4002D2E8"/>
            <inst addr="0x4002D2EC"/>
            <succ>
               <link type="nottaken" cfg="c12" bb="c12b4"/>
            </succ>
         </bb>
         <bb id="c12b3">
            <prec>
               <link type="taken" cfg="c12" bb="c12b1"/>
            </prec>
            <inst addr="0x4002D2E4"/>
            <inst addr="0x4002D2F0" src="s3" line="13"/>
            <inst addr="0x4002D2F4"/>
            <inst addr="0x4002D2F8"/>
            <inst addr="0x4002D2FC"/>
            <inst addr="0x4002D300"/>
            <inst addr="0x4002D304" src="s3" line="14"/>
            <inst addr="0x4002D308"/>
            <inst addr="0x4002D30C"/>
            <inst addr="0x4002D310"/>
            <inst addr="0x4002D314"/>
            <inst addr="0x4002D318" src="s3" line="15"/>
            <inst addr="0x4002D31C"/>
            <inst addr="0x4002D320"/>
            <inst addr="0x4002D324"/>
            <inst addr="0x4002D328"/>
            <inst addr="0x4002D32C" src="s3" line="16"/>
            <inst addr="0x4002D330"/>
            <inst addr="0x4002D334"/>
            <inst addr="0x4002D338"/>
            <inst addr="0x4002D33C"/>
            <succ>
               <link type="nottaken" cfg="c12" bb="c12b4"/>
            </succ>
         </bb>
         <bb id="c12b4">
            <prec>
               <link type="nottaken" cfg="c12" bb="c12b2"/>
               <link type="nottaken" cfg="c12" bb="c12b3"/>
            </prec>
            <inst addr="0x4002D340" src="s3" line="18"/>
            <inst addr="0x4002D344"/>
            <inst addr="0x4002D348"/>
         </bb>
      </cfg>
      <cfg id="c13" name="xgnc__guidance__gnc_attitude_calculation_start">
         <bb id="c13b1">
            <prec>
               <link type="call" cfg="c7" bb="c7b3"/>
            </prec>
            <inst addr="0x4002D3E8" src="s3" line="35"/>
            <inst addr="0x4002D3EC"/>
            <inst addr="0x4002D3F0"/>
            <inst addr="0x4002D3F4" src="s3" line="38"/>
            <inst addr="0x4002D3F8"/>
            <inst addr="0x4002D3FC"/>
            <succ>
               <link type="call" cfg="c21" bb="c21b1"/>
               <link type="nottaken" cfg="c13" bb="c13b3"/>
            </succ>
         </bb>
         <bb id="c13b3">
            <prec>
               <link type="nottaken" cfg="c13" bb="c13b1"/>
            </prec>
            <inst addr="0x4002D400" src="s3" line="39"/>
            <inst addr="0x4002D404"/>
            <inst addr="0x4002D408"/>
            <succ>
               <link type="call" cfg="c22" bb="c22b1"/>
               <link type="nottaken" cfg="c13" bb="c13b5"/>
            </succ>
         </bb>
         <bb id="c13b5">
            <prec>
               <link type="nottaken" cfg="c13" bb="c13b3"/>
            </prec>
            <inst addr="0x4002D40C" src="s3" line="40"/>
            <inst addr="0x4002D410"/>
            <inst addr="0x4002D414"/>
         </bb>
      </cfg>
      <cfg id="c21" name="xgnc__guidance__gnc_attitude_calculation_disable">
         <bb id="c21b1">
            <prec>
               <link type="call" cfg="c13" bb="c13b1"/>
               <link type="call" cfg="c14" bb="c14b13"/>
            </prec>
            <inst addr="0x4002D3C8" src="s3" line="30"/>
            <inst addr="0x4002D3CC"/>
            <inst addr="0x4002D3D0" src="s3" line="32"/>
            <inst addr="0x4002D3D4"/>
            <inst addr="0x4002D3D8"/>
            <inst addr="0x4002D3DC" src="s3" line="33"/>
            <inst addr="0x4002D3E0"/>
            <inst addr="0x4002D3E4"/>
         </bb>
      </cfg>
      <cfg id="c22" name="xgnc__guidance__gnc_attitude_calculation_init">
         <bb id="c22b1">
            <prec>
               <link type="call" cfg="c13" bb="c13b3"/>
               <link type="call" cfg="c14" bb="c14b5"/>
            </prec>
            <inst addr="0x4002D34C" src="s3" line="20"/>
            <inst addr="0x4002D350"/>
            <inst addr="0x4002D354" src="s3" line="22"/>
            <inst addr="0x4002D358"/>
            <inst addr="0x4002D35C"/>
            <inst addr="0x4002D360"/>
            <inst addr="0x4002D364"/>
            <inst addr="0x4002D368" src="s3" line="23"/>
            <inst addr="0x4002D36C"/>
            <inst addr="0x4002D370"/>
            <inst addr="0x4002D374"/>
            <inst addr="0x4002D378"/>
            <inst addr="0x4002D37C" src="s3" line="24"/>
            <inst addr="0x4002D380"/>
            <inst addr="0x4002D384"/>
            <inst addr="0x4002D388"/>
            <inst addr="0x4002D38C"/>
            <inst addr="0x4002D390" src="s3" line="25"/>
            <inst addr="0x4002D394"/>
            <inst addr="0x4002D398"/>
            <inst addr="0x4002D39C"/>
            <inst addr="0x4002D3A0"/>
            <inst addr="0x4002D3A4" src="s3" line="26"/>
            <inst addr="0x4002D3A8"/>
            <inst addr="0x4002D3AC"/>
            <inst addr="0x4002D3B0" src="s3" line="27"/>
            <inst addr="0x4002D3B4"/>
            <inst addr="0x4002D3B8"/>
            <inst addr="0x4002D3BC" src="s3" line="28"/>
            <inst addr="0x4002D3C0"/>
            <inst addr="0x4002D3C4"/>
         </bb>
      </cfg>
      <cfg id="c14" name="xgnc__guidance__gnc_attitude_calculation">
         <bb id="c14b1">
            <prec>
               <link type="call" cfg="c7" bb="c7b5"/>
            </prec>
            <inst addr="0x4002D418" src="s3" line="42"/>
            <inst addr="0x4002D41C"/>
            <inst addr="0x4002D420"/>
            <inst addr="0x4002D424"/>
            <inst addr="0x4002D428"/>
            <inst addr="0x4002D42C" src="s3" line="63"/>
            <inst addr="0x4002D430"/>
            <inst addr="0x4002D434"/>
            <inst addr="0x4002D438"/>
            <inst addr="0x4002D43C"/>
            <inst addr="0x4002D440"/>
            <inst addr="0x4002D444"/>
            <inst addr="0x4002D448"/>
            <inst addr="0x4002D44C"/>
            <inst addr="0x4002D450"/>
            <inst addr="0x4002D454"/>
            <inst addr="0x4002D458"/>
            <inst addr="0x4002D45C"/>
            <inst addr="0x4002D460"/>
            <inst addr="0x4002D464"/>
            <inst addr="0x4002D468"/>
            <inst addr="0x4002D46C" src="s3" line="64"/>
            <inst addr="0x4002D470"/>
            <inst addr="0x4002D474"/>
            <inst addr="0x4002D478"/>
            <inst addr="0x4002D47C" src="s3" line="65"/>
            <inst addr="0x4002D480"/>
            <inst addr="0x4002D484"/>
            <inst addr="0x4002D488"/>
            <inst addr="0x4002D48C" src="s3" line="66"/>
            <inst addr="0x4002D490"/>
            <inst addr="0x4002D494"/>
            <inst addr="0x4002D498"/>
            <inst addr="0x4002D49C"/>
            <inst addr="0x4002D4A0"/>
            <inst addr="0x4002D4A4"/>
            <inst addr="0x4002D4A8"/>
            <inst addr="0x4002D4AC"/>
            <inst addr="0x4002D4B0"/>
            <inst addr="0x4002D4B4"/>
            <inst addr="0x4002D4B8"/>
            <inst addr="0x4002D4BC"/>
            <inst addr="0x4002D4C0"/>
            <inst addr="0x4002D4C4"/>
            <inst addr="0x4002D4C8"/>
            <inst addr="0x4002D4CC" src="s3" line="67"/>
            <inst addr="0x4002D4D0"/>
            <inst addr="0x4002D4D4"/>
            <inst addr="0x4002D4D8"/>
            <inst addr="0x4002D4DC"/>
            <inst addr="0x4002D4E0"/>
            <inst addr="0x4002D4E4"/>
            <inst addr="0x4002D4E8"/>
            <inst addr="0x4002D4EC"/>
            <inst addr="0x4002D4F0"/>
            <inst addr="0x4002D4F4"/>
            <inst addr="0x4002D4F8"/>
            <inst addr="0x4002D4FC"/>
            <inst addr="0x4002D500"/>
            <inst addr="0x4002D504"/>
            <inst addr="0x4002D508"/>
            <inst addr="0x4002D50C" src="s3" line="68"/>
            <inst addr="0x4002D510"/>
            <inst addr="0x4002D514"/>
            <inst addr="0x4002D518"/>
            <inst addr="0x4002D51C" src="s3" line="69"/>
            <inst addr="0x4002D520"/>
            <inst addr="0x4002D524"/>
            <inst addr="0x4002D528"/>
            <inst addr="0x4002D52C" src="s3" line="70"/>
            <inst addr="0x4002D530"/>
            <inst addr="0x4002D534"/>
            <inst addr="0x4002D538"/>
            <inst addr="0x4002D53C" src="s3" line="71"/>
            <inst addr="0x4002D540"/>
            <inst addr="0x4002D544"/>
            <inst addr="0x4002D548"/>
            <inst addr="0x4002D54C" src="s3" line="72"/>
            <inst addr="0x4002D550"/>
            <inst addr="0x4002D554"/>
            <inst addr="0x4002D558"/>
            <inst addr="0x4002D55C" src="s3" line="73"/>
            <inst addr="0x4002D560"/>
            <inst addr="0x4002D564"/>
            <inst addr="0x4002D568"/>
            <inst addr="0x4002D56C" src="s3" line="75"/>
            <inst addr="0x4002D570"/>
            <inst addr="0x4002D574"/>
            <inst addr="0x4002D578"/>
            <inst addr="0x4002D57C"/>
            <inst addr="0x4002D580"/>
            <inst addr="0x4002D584"/>
            <succ>
               <link type="nottaken" cfg="c14" bb="c14b2"/>
               <link type="taken" cfg="c14" bb="c14b3"/>
            </succ>
         </bb>
         <bb id="c14b2">
            <prec>
               <link type="nottaken" cfg="c14" bb="c14b1"/>
            </prec>
            <inst addr="0x4002D588"/>
            <inst addr="0x4002D58C"/>
            <inst addr="0x4002D590"/>
            <inst addr="0x4002D5A8" src="s3" line="78"/>
            <succ>
               <link type="nottaken" cfg="c14" bb="c14b4"/>
            </succ>
         </bb>
         <bb id="c14b3">
            <prec>
               <link type="taken" cfg="c14" bb="c14b1"/>
            </prec>
            <inst addr="0x4002D588"/>
            <inst addr="0x4002D594" src="s3" line="76"/>
            <inst addr="0x4002D598"/>
            <inst addr="0x4002D59C"/>
            <inst addr="0x4002D5A0"/>
            <inst addr="0x4002D5A4"/>
            <succ>
               <link type="nottaken" cfg="c14" bb="c14b4"/>
            </succ>
         </bb>
         <bb id="c14b4">
            <prec>
               <link type="nottaken" cfg="c14" bb="c14b2"/>
               <link type="nottaken" cfg="c14" bb="c14b3"/>
            </prec>
            <inst addr="0x4002D5AC" src="s3" line="81"/>
            <inst addr="0x4002D5B0"/>
            <inst addr="0x4002D5B4"/>
            <inst addr="0x4002D5B8"/>
            <succ>
               <link type="nottaken" cfg="c14" bb="c14b5"/>
               <link type="taken" cfg="c14" bb="c14b6"/>
            </succ>
         </bb>
         <bb id="c14b5">
            <prec>
               <link type="nottaken" cfg="c14" bb="c14b4"/>
            </prec>
            <inst addr="0x4002D5BC"/>
            <inst addr="0x4002D5C0" src="s3" line="82"/>
            <inst addr="0x4002D5C4"/>
            <inst addr="0x4002D5C8"/>
            <succ>
               <link type="call" cfg="c22" bb="c22b1"/>
               <link type="nottaken" cfg="c14" bb="c14b10"/>
            </succ>
         </bb>
         <bb id="c14b6">
            <prec>
               <link type="taken" cfg="c14" bb="c14b4"/>
            </prec>
            <inst addr="0x4002D5BC"/>
            <inst addr="0x4002D608" src="s3" line="84"/>
            <inst addr="0x4002D60C"/>
            <inst addr="0x4002D610"/>
            <inst addr="0x4002D614"/>
            <succ>
               <link type="nottaken" cfg="c14" bb="c14b8"/>
               <link type="taken" cfg="c14" bb="c14b9"/>
            </succ>
         </bb>
         <bb id="c14b8">
            <prec>
               <link type="nottaken" cfg="c14" bb="c14b6"/>
            </prec>
            <inst addr="0x4002D618"/>
            <inst addr="0x4002D61C" src="s3" line="85"/>
            <inst addr="0x4002D620"/>
            <inst addr="0x4002D624"/>
            <inst addr="0x4002D628"/>
            <inst addr="0x4002D62C" src="s3" line="86"/>
            <inst addr="0x4002D630"/>
            <inst addr="0x4002D634"/>
            <inst addr="0x4002D638"/>
            <inst addr="0x4002D63C" src="s3" line="87"/>
            <inst addr="0x4002D640"/>
            <inst addr="0x4002D644"/>
            <inst addr="0x4002D648"/>
            <inst addr="0x4002D64C" src="s3" line="88"/>
            <inst addr="0x4002D650"/>
            <inst addr="0x4002D654"/>
            <inst addr="0x4002D658"/>
            <inst addr="0x4002D65C" src="s3" line="89"/>
            <inst addr="0x4002D660"/>
            <inst addr="0x4002D664" src="s3" line="90"/>
            <inst addr="0x4002D668"/>
            <inst addr="0x4002D66C"/>
            <inst addr="0x4002D670" src="s3" line="91"/>
            <inst addr="0x4002D674"/>
            <inst addr="0x4002D678"/>
            <inst addr="0x4002D67C"/>
            <inst addr="0x4002D680"/>
            <inst addr="0x4002D684" src="s3" line="92"/>
            <inst addr="0x4002D688"/>
            <inst addr="0x4002D68C"/>
            <inst addr="0x4002D690"/>
            <inst addr="0x4002D694"/>
            <inst addr="0x4002D698" src="s3" line="93"/>
            <inst addr="0x4002D69C"/>
            <inst addr="0x4002D6A0"/>
            <inst addr="0x4002D6A4"/>
            <inst addr="0x4002D6A8"/>
            <inst addr="0x4002D6AC" src="s3" line="94"/>
            <inst addr="0x4002D6B0"/>
            <inst addr="0x4002D6B4"/>
            <inst addr="0x4002D6B8"/>
            <inst addr="0x4002D6BC"/>
            <inst addr="0x4002D6C0"/>
            <inst addr="0x4002D6C4"/>
            <inst addr="0x4002D6C8"/>
            <inst addr="0x4002D6CC"/>
            <inst addr="0x4002D6D0"/>
            <inst addr="0x4002D6D4"/>
            <inst addr="0x4002D6D8"/>
            <inst addr="0x4002D6DC"/>
            <inst addr="0x4002D6E0" src="s3" line="95"/>
            <inst addr="0x4002D6E4"/>
            <inst addr="0x4002D6E8"/>
            <inst addr="0x4002D6EC"/>
            <inst addr="0x4002D6F0" src="s3" line="96"/>
            <inst addr="0x4002D6F4"/>
            <inst addr="0x4002D6F8"/>
            <inst addr="0x4002D6FC"/>
            <inst addr="0x4002D700"/>
            <inst addr="0x4002D704"/>
            <inst addr="0x4002D708"/>
            <inst addr="0x4002D70C"/>
            <inst addr="0x4002D710" src="s3" line="97"/>
            <inst addr="0x4002D714"/>
            <inst addr="0x4002D718"/>
            <inst addr="0x4002D71C"/>
            <inst addr="0x4002D720"/>
            <inst addr="0x4002D724"/>
            <inst addr="0x4002D728"/>
            <inst addr="0x4002D72C"/>
            <inst addr="0x4002D730" src="s3" line="98"/>
            <inst addr="0x4002D734"/>
            <inst addr="0x4002D738"/>
            <inst addr="0x4002D73C"/>
            <inst addr="0x4002D740"/>
            <inst addr="0x4002D744"/>
            <inst addr="0x4002D748" src="s3" line="99"/>
            <inst addr="0x4002D74C"/>
            <inst addr="0x4002D750"/>
            <inst addr="0x4002D754"/>
            <inst addr="0x4002D758"/>
            <inst addr="0x4002D75C"/>
            <inst addr="0x4002D760"/>
            <succ>
               <link type="nottaken" cfg="c14" bb="c14b11"/>
               <link type="taken" cfg="c14" bb="c14b12"/>
            </succ>
         </bb>
         <bb id="c14b9">
            <prec>
               <link type="taken" cfg="c14" bb="c14b6"/>
            </prec>
            <inst addr="0x4002D618"/>
            <inst addr="0x4002D884" src="s3" line="113"/>
            <inst addr="0x4002D888"/>
            <inst addr="0x4002D88C"/>
            <inst addr="0x4002D890"/>
            <succ>
               <link type="nottaken" cfg="c14" bb="c14b13"/>
               <link type="taken" cfg="c14" bb="c14b14"/>
            </succ>
         </bb>
         <bb id="c14b10">
            <prec>
               <link type="nottaken" cfg="c14" bb="c14b5"/>
            </prec>
            <inst addr="0x4002D5CC" src="s3" line="83"/>
            <inst addr="0x4002D5D0"/>
            <inst addr="0x4002D5D4"/>
            <inst addr="0x4002D5D8"/>
            <inst addr="0x4002D5DC"/>
            <inst addr="0x4002D5E0"/>
            <inst addr="0x4002D5E4"/>
            <inst addr="0x4002D5E8"/>
            <inst addr="0x4002D5EC"/>
            <inst addr="0x4002D5F0"/>
            <inst addr="0x4002D5F4"/>
            <inst addr="0x4002D5F8"/>
            <inst addr="0x4002D5FC"/>
            <inst addr="0x4002D600"/>
            <inst addr="0x4002D604"/>
            <succ>
               <link type="nottaken" cfg="c14" bb="c14b15"/>
            </succ>
         </bb>
         <bb id="c14b11">
            <prec>
               <link type="nottaken" cfg="c14" bb="c14b8"/>
            </prec>
            <inst addr="0x4002D764"/>
            <inst addr="0x4002D768"/>
            <inst addr="0x4002D76C"/>
            <inst addr="0x4002D784" src="s3" line="102"/>
            <inst addr="0x4002D788"/>
            <succ>
               <link type="nottaken" cfg="c14" bb="c14b16"/>
            </succ>
         </bb>
         <bb id="c14b12">
            <prec>
               <link type="taken" cfg="c14" bb="c14b8"/>
            </prec>
            <inst addr="0x4002D764"/>
            <inst addr="0x4002D770" src="s3" line="100"/>
            <inst addr="0x4002D774"/>
            <inst addr="0x4002D778"/>
            <inst addr="0x4002D77C"/>
            <inst addr="0x4002D780"/>
            <succ>
               <link type="nottaken" cfg="c14" bb="c14b16"/>
            </succ>
         </bb>
         <bb id="c14b13">
            <prec>
               <link type="nottaken" cfg="c14" bb="c14b9"/>
            </prec>
            <inst addr="0x4002D894"/>
            <inst addr="0x4002D898" src="s3" line="114"/>
            <inst addr="0x4002D89C"/>
            <inst addr="0x4002D8A0"/>
            <succ>
               <link type="call" cfg="c21" bb="c21b1"/>